Paragraphe 1;Paragraphe 2;Paragraphe 3;Paragraphe 4;Paragraphe 5;;;;;;;;;;;;;;;;;;;;;;;;;;;;;;;;;;;;;;;;;;;;;;;;;;;;;;;;;;;;;;;;;;;;;;;;;;;;;;;;;;;;;;;;;;;;;;;;;;;;;;;;;;;;;;;;;;;;;;;;;;;;;;;;;;;;;;;;;;;;;;;;;;;;;;;;;;;;;;;;;;;;;;;;;;;;;;;;;;;;;;;;;;;;;;;;;;;;;;;;;;;;;;;;;;;;;;;;;;;;;;;;;;;;;;;;;;;;;;;;;;;;;;;;;;;
La lecture de ton profil m’a donné envie d’en savoir plus sur toi, histoire d’en apprendre d’avantage. J’espère ne pas te déranger si tu es occupé.;Je trouve que ton profil correspond à ce qui me plait chez un homme. Je suis une femme plut mignonne, enfin du moins je le pense.;Je suis actuellement en colloc avec ma cousine, mais elle doit partir la semaine prochaine, donc si ça te dit j’ai un endroit pour te recevoir.;Très impatiente de pouvoir te rencontrer pour discuter avec toi.;Je serai sur le tchat ce soir je pense, tu sais où me trouver.;;;;;;;;;;;;;;;;;;;;;;;;;;;;;;;;;;;;;;;;;;;;;;;;;;;;;;;;;;;;;;;;;;;;;;;;;;;;;;;;;;;;;;;;;;;;;;;;;;;;;;;;;;;;;;;;;;;;;;;;;;;;;;;;;;;;;;;;;;;;;;;;;;;;;;;;;;;;;;;;;;;;;;;;;;;;;;;;;;;;;;;;;;;;;;;;;;;;;;;;;;;;;;;;;;;;;;;;;;;;;;;;;;;;;;;;;;;;;;;;;;;;;;;;;;;
Bon je veux pas que tu me prennes pour une chasseuse du fait que je te contacte comme ça. Je tiens avant toute chose à te préciser que ce n’est pas dans mes habitudes mais je dois t’avouer que ton profil m’intéresse, et c’est pour cette raison que j’ai décidé de te contacter.;Ton profil m’inspire confiance, et je te trouve très à mon gout. Pour ma part, je suis une femme très douce et pétillante, qui aime les hommes gentils.;Tu ne m’as même pas encore répondu mais si dans l’éventualité où nos premiers échanges sont encourageants, je tiens à te dire que je préfère recevoir chez moi que de devoir me déplacer.;J’espère que dans ta réponse, tu sauras me montrer que je peux t’intéresser.;Si tu veux me retrouver au plus vite, je pense me connecter au tchat dans peu de temps.;;;;;;;;;;;;;;;;;;;;;;;;;;;;;;;;;;;;;;;;;;;;;;;;;;;;;;;;;;;;;;;;;;;;;;;;;;;;;;;;;;;;;;;;;;;;;;;;;;;;;;;;;;;;;;;;;;;;;;;;;;;;;;;;;;;;;;;;;;;;;;;;;;;;;;;;;;;;;;;;;;;;;;;;;;;;;;;;;;;;;;;;;;;;;;;;;;;;;;;;;;;;;;;;;;;;;;;;;;;;;;;;;;;;;;;;;;;;;;;;;;;;;;;;;;;
J’ai hésité un long moment et puis je me suis dit que ce serait tout de même dommage de ne pas faire pour une fois le premier pas. J’aimerais en savoir un peu plus sur toi.;Je sais pas pourquoi mais tu as l’air d’être un mec sympa et plaisant. Pour ma part, j’aime plaisanter et passer de bons moments.;Je suis du même secteur que toi, je vis à proximité de chez toi mais pour une première rencontre j’aimerais que cela se fasse dans un endroit classique comme un des cafés du centre ville par exemple.;Je dois t’avouer que je suis impatiente de recevoir une réponse positive de ta part car je suis persuadée que l’on va bien s’entendre.;Si tu veux me retrouver sur le tchat, je t’y attendrai avec impatience.;;;;;;;;;;;;;;;;;;;;;;;;;;;;;;;;;;;;;;;;;;;;;;;;;;;;;;;;;;;;;;;;;;;;;;;;;;;;;;;;;;;;;;;;;;;;;;;;;;;;;;;;;;;;;;;;;;;;;;;;;;;;;;;;;;;;;;;;;;;;;;;;;;;;;;;;;;;;;;;;;;;;;;;;;;;;;;;;;;;;;;;;;;;;;;;;;;;;;;;;;;;;;;;;;;;;;;;;;;;;;;;;;;;;;;;;;;;;;;;;;;;;;;;;;;;
Tu dois te dire que je suis déterminée pour te contacter comme je le fais… Et bien si c’est le cas, tu n’as pas tout à fait tort, depuis que j’ai vu ton profil, ton visage est dans ma tête et je pense qu’il faudrait vraiment que l’on apprenne à se connaitre.;Hier encore, j’ai regardé ta fiche de profil et je me suis dis que tu correspond à ce que je cherche chez un homme. .;J’espère que ton retour sera positif, et si tel était le cas, je préfère de loin te rencontrer en terrasse d’un café par exemple, je trouve ça mieux que le virtuel pour faire connaissance.;e suis convaincue qu’un face à face avec toi est plus que prometteur si tu assures autant que tu as l’air sur ton profil.;Un gros bisou à toi, et à très bientôt je l’espère.;;;;;;;;;;;;;;;;;;;;;;;;;;;;;;;;;;;;;;;;;;;;;;;;;;;;;;;;;;;;;;;;;;;;;;;;;;;;;;;;;;;;;;;;;;;;;;;;;;;;;;;;;;;;;;;;;;;;;;;;;;;;;;;;;;;;;;;;;;;;;;;;;;;;;;;;;;;;;;;;;;;;;;;;;;;;;;;;;;;;;;;;;;;;;;;;;;;;;;;;;;;;;;;;;;;;;;;;;;;;;;;;;;;;;;;;;;;;;;;;;;;;;;;;;;;
J’ai hésité un moment avant de te contacter parce que je me suis dis que beau comme tu es, tu dois en recevoir des tas, mais sérieusement je pense pouvoir faire face à la concurrence.;Je pense avoir ce qu’il faut pour te faire craquer, je prends soin de moi et je pense être assez jolie.;J’habite à deux pas de l’église, et pour être honnête je n’ai rien de prévu encore qui m’empêcherait d’aller boire un bon verre avec toi histoire de voir si toi et moi… enfin voila quoi pas besoin de te faire un dessin.;Je pense que tu aurais tort de refuser cette proposition car sans prétention je pense être une femme bien.;Je te laisse en espérant de te retrouver très vite… Je t’embrasse tendrement.;;;;;;;;;;;;;;;;;;;;;;;;;;;;;;;;;;;;;;;;;;;;;;;;;;;;;;;;;;;;;;;;;;;;;;;;;;;;;;;;;;;;;;;;;;;;;;;;;;;;;;;;;;;;;;;;;;;;;;;;;;;;;;;;;;;;;;;;;;;;;;;;;;;;;;;;;;;;;;;;;;;;;;;;;;;;;;;;;;;;;;;;;;;;;;;;;;;;;;;;;;;;;;;;;;;;;;;;;;;;;;;;;;;;;;;;;;;;;;;;;;;;;;;;;;;
C’est vrai que ce sont très souvent les hommes qui font le premier pas, mais j’ai vu ton profil et j’ai très envie d’apprendre à te connaitre, voila pourquoi je force un peu le destin.;Je ne sais pas ce qui te plait chez une femme, mais de mon coté je sais me donner les moyens de charmer celui qui me plait. J’aime me mettre en valeur et plaire à celui qui m’attire.;Comme tu peux le voir, j’ai très envie de te connaitre, alors bouges ton joli corps pour me répondre et que l’on ne tarde pas à faire plus ample connaissance.;Il me tarde vraiment te voir, je pense qu’il y a moyen que toi et moi passons du bon temps.;Si ça te dit ce soir on peut se faire une petite discussion sur le chat.;;;;;;;;;;;;;;;;;;;;;;;;;;;;;;;;;;;;;;;;;;;;;;;;;;;;;;;;;;;;;;;;;;;;;;;;;;;;;;;;;;;;;;;;;;;;;;;;;;;;;;;;;;;;;;;;;;;;;;;;;;;;;;;;;;;;;;;;;;;;;;;;;;;;;;;;;;;;;;;;;;;;;;;;;;;;;;;;;;;;;;;;;;;;;;;;;;;;;;;;;;;;;;;;;;;;;;;;;;;;;;;;;;;;;;;;;;;;;;;;;;;;;;;;;;;
Désolé de te contacter comme je le fais alors que l’on ne se connait même pas mais quand je veux quelque chose je suis assez déterminée et je pense pouvoir te plaire.;Plus j’y pense et plus je me dis que te rencontrer serait une bonne chose, tu me plais physiquement et j’espère que je te plairais aussi.;Pour ce qui est de mes disponibilités, alors je suis assez prise par mon boulot, mais si tu sais me donner envie, je n’aurais aucun scrupule à me porter pale pour t’offrir un peu de mon temps.;Je ne sais pas encore ce que tu penses de tout ça mais moi de mon côté je suis très enthousiaste.;Si tu es impatient comme je le suis, je pense passer sur le tchat ce soir.;;;;;;;;;;;;;;;;;;;;;;;;;;;;;;;;;;;;;;;;;;;;;;;;;;;;;;;;;;;;;;;;;;;;;;;;;;;;;;;;;;;;;;;;;;;;;;;;;;;;;;;;;;;;;;;;;;;;;;;;;;;;;;;;;;;;;;;;;;;;;;;;;;;;;;;;;;;;;;;;;;;;;;;;;;;;;;;;;;;;;;;;;;;;;;;;;;;;;;;;;;;;;;;;;;;;;;;;;;;;;;;;;;;;;;;;;;;;;;;;;;;;;;;;;;;
Pas très courageuse d’habitude, bizarrement, l’envie de te connaitre m’a donné le courage nécessaire pour t’écrire ce message..;Malgré ma timidité, je sais faire ce qu’il faut pour plaire à ceux qui me plaisent, et mon calme apparent n’est là que pour masquer mon coté peu farouche.;J’habite à 200 mètres du centre, et je pense que ce serait l’idéal de pouvoir s’y retrouver pour papoter. Et on ne serait pas très loin de chez moi si jamais, le destin fait que l’on ait envie de prolonger tout ça au chaud.;Je suis étonnée du bon feeling que j’ai sur toi car ce n’est pas dans mes habitudes, et c’est rare que je me trompe.;Dans l’attente de ton message… Bis.;;;;;;;;;;;;;;;;;;;;;;;;;;;;;;;;;;;;;;;;;;;;;;;;;;;;;;;;;;;;;;;;;;;;;;;;;;;;;;;;;;;;;;;;;;;;;;;;;;;;;;;;;;;;;;;;;;;;;;;;;;;;;;;;;;;;;;;;;;;;;;;;;;;;;;;;;;;;;;;;;;;;;;;;;;;;;;;;;;;;;;;;;;;;;;;;;;;;;;;;;;;;;;;;;;;;;;;;;;;;;;;;;;;;;;;;;;;;;;;;;;;;;;;;;;;
Coucou bel inconnu, dispo pour faire des rencontres? Ca te dirait de faire connaissance?;Moi je suis un petit bout de femme en manque d’affection, qui ne cherche que la complicité d’un beau mec respectueux.;Je viens d’arriver dans le secteur, et pour être honnête, je n’ai même pas encore pris le temps de visiter, peut-être que tu es un très bon guide!!;J’aime bien bavarder mais j’aimerais particulièrement le faire au plus vite avec toi pour voir si mes intuitions sont bonnes.;Je garde ma session ouverte, fais moi signe si tu veux me parler.;;;;;;;;;;;;;;;;;;;;;;;;;;;;;;;;;;;;;;;;;;;;;;;;;;;;;;;;;;;;;;;;;;;;;;;;;;;;;;;;;;;;;;;;;;;;;;;;;;;;;;;;;;;;;;;;;;;;;;;;;;;;;;;;;;;;;;;;;;;;;;;;;;;;;;;;;;;;;;;;;;;;;;;;;;;;;;;;;;;;;;;;;;;;;;;;;;;;;;;;;;;;;;;;;;;;;;;;;;;;;;;;;;;;;;;;;;;;;;;;;;;;;;;;;;;
Bonjour, j’espère na pas être trop franche, mais on est sur un site de rencontre, ton profil m’a vraiment plus… Alors voila pourquoi je suis ici en train de t’écrire.;Je me trouve plutôt mignonne, enfin on va dire que quand je regarde les autres je n’ai pas à me plaindre.. Je suis une femme très tactile et douce, et j’adore les mecs qui m’inspirent de la sécurité.;Mon activité professionnelle fait que j’ai la possibilité de bosser depuis chez moi donc n’hésites pas à me proposer une petite pause car cela me ferait le plus grand bien.;Je suis plus qu’impatiente de pouvoir faire ta connaissance.;Je regarde souvent ma boite de réception donc si tu me réponds je ne tarderai pas de le voir.;;;;;;;;;;;;;;;;;;;;;;;;;;;;;;;;;;;;;;;;;;;;;;;;;;;;;;;;;;;;;;;;;;;;;;;;;;;;;;;;;;;;;;;;;;;;;;;;;;;;;;;;;;;;;;;;;;;;;;;;;;;;;;;;;;;;;;;;;;;;;;;;;;;;;;;;;;;;;;;;;;;;;;;;;;;;;;;;;;;;;;;;;;;;;;;;;;;;;;;;;;;;;;;;;;;;;;;;;;;;;;;;;;;;;;;;;;;;;;;;;;;;;;;;;;;
Salut, je suis là pour faire connaissance avec des hommes et ayant parcouru ton profil plusieurs fois, tu m’as l’air d’un mec sympa et ça me donne envie de te connaitre. ;"Je suis une femme qui ne prend pas la tête et toujours de bonne humeur. Sans me vanter, je pense être une bonne affaire ;) .";J’ai un emploi du temps qui me permet aisément de me libérer en journée et en soirée, vu que je me trouve à 2 pas du centre, je pense que se retrouver là bas serait pas mal. Pas pour manger car si tu es aussi  beau que sur ton profil, cela va me couper l’appétit mais boire un verre me mettrait plus à l’aise, alors si ça te dit…;Je t’avoue que je serais frustrée de ne pas avoir de réponse de ta part, car tu serais ma plus grosse déception sur ce site.;En espérant que tu voies ce message au plus vite.. Bisou.;;;;;;;;;;;;;;;;;;;;;;;;;;;;;;;;;;;;;;;;;;;;;;;;;;;;;;;;;;;;;;;;;;;;;;;;;;;;;;;;;;;;;;;;;;;;;;;;;;;;;;;;;;;;;;;;;;;;;;;;;;;;;;;;;;;;;;;;;;;;;;;;;;;;;;;;;;;;;;;;;;;;;;;;;;;;;;;;;;;;;;;;;;;;;;;;;;;;;;;;;;;;;;;;;;;;;;;;;;;;;;;;;;;;;;;;;;;;;;;;;;;;;;;;;;;
C’est vrai que c’est assez rare qu’une femme fasse le premier pas mais je flache trop rarement sur des profils pour passer à côté d’un profil comme le tien.;Je pense te plaire physiquement, je ne veux pas paraitre prétentieuse mais je suis beaucoup courtisée par les mecs, mais moi ce que je veux c’est simplement m’amuser.;Je dois te dire que le bla bla sur l’ordinateur ça va 5mn, mais je préfèrerai de loin faire ta connaissance entre 4 yeux dans un restaurant, un bar, chez toi ou encore chez moi…;J’ai un très bon ressenti sur notre éventuelle future rencontre, dès fois il y a des choses sur lesquelles je suis convaincue.;En espérant avoir de tes nouvelles au plus vite, je te laisse non sans te faire un tendre bisou, qui j’espère ne sera pas le dernier…;;;;;;;;;;;;;;;;;;;;;;;;;;;;;;;;;;;;;;;;;;;;;;;;;;;;;;;;;;;;;;;;;;;;;;;;;;;;;;;;;;;;;;;;;;;;;;;;;;;;;;;;;;;;;;;;;;;;;;;;;;;;;;;;;;;;;;;;;;;;;;;;;;;;;;;;;;;;;;;;;;;;;;;;;;;;;;;;;;;;;;;;;;;;;;;;;;;;;;;;;;;;;;;;;;;;;;;;;;;;;;;;;;;;;;;;;;;;;;;;;;;;;;;;;;;
Je pense que tu vas être étonné de recevoir un message de moi mais avant toute rencontre, il faut que l’un des 2 fasse le premier pas !;C’est bizarre mais tu m’as l’air d’un gras très sympathique et honnêtement c’est ce qui me pousse à vouloir te rencontrer, car je sens que tu as ce qu’il faut pour me faire fondre.;Comment verrais tu une première rencontre avec moi, plutôt dans un endroit public comme un café ou un ciné ou alors dans un endroit plus intimiste comme chez moi ou encore ma chambre???;Ici sur ce site, je vais être honnête avec toi, te rencontrer et te charmer est ma priorité.;Je ne te dis pas au revoir, mais à très bientôt j’espère.;;;;;;;;;;;;;;;;;;;;;;;;;;;;;;;;;;;;;;;;;;;;;;;;;;;;;;;;;;;;;;;;;;;;;;;;;;;;;;;;;;;;;;;;;;;;;;;;;;;;;;;;;;;;;;;;;;;;;;;;;;;;;;;;;;;;;;;;;;;;;;;;;;;;;;;;;;;;;;;;;;;;;;;;;;;;;;;;;;;;;;;;;;;;;;;;;;;;;;;;;;;;;;;;;;;;;;;;;;;;;;;;;;;;;;;;;;;;;;;;;;;;;;;;;;;
Je vais être honnête avec toi, cela fait un long moment que je suis inscrite sur ce site de rencontre, et c’est la première fois qu’un profil me donne l’envie de prendre contact la première.;Je suis une femme qui comme toi cherche à faire des rencontres plus ou moins sérieuses sans prise de tête, et tu fais partie de ceux avec qui c’est potentiellement réalisable.;Je viens de faire mon retour ici car j’avais quitté la région pour suivre mon ex il y a de ça quelques temps, j’ai pu récupérer mon appartement que j’avais mis en location, et je n’ai aucun soucis à recevoir, si je juge que tu en vaux vraiment la peine bien évidement.;Je suis sure que si tu acceptes ma proposition tu ne seras pas déçue par celle qui se présentera face à toi.;Voila voila, à tout de suite..;;;;;;;;;;;;;;;;;;;;;;;;;;;;;;;;;;;;;;;;;;;;;;;;;;;;;;;;;;;;;;;;;;;;;;;;;;;;;;;;;;;;;;;;;;;;;;;;;;;;;;;;;;;;;;;;;;;;;;;;;;;;;;;;;;;;;;;;;;;;;;;;;;;;;;;;;;;;;;;;;;;;;;;;;;;;;;;;;;;;;;;;;;;;;;;;;;;;;;;;;;;;;;;;;;;;;;;;;;;;;;;;;;;;;;;;;;;;;;;;;;;;;;;;;;;
Bien que je trouve ça  un peu bizarre de contacter un inconnu comme ça, je me dis que si l’on est sur un site de rencontre, c’est pour rencontrer des inconnus, alors je me lance…;Je ne vais pas te donner mes mensurations non plus mais j’aime ce que je suis physiquement, et je sais me mettre en valeur pour plaire aux hommes.;Je n’habite pas dans le centre mais j’ai une voiture pour me déplacer donc si ta réponse est positive je n’ai aucun soucis à te rejoindre dans le lieu de ton choix.;Que dire de plus à part que je suis impatiente que tu me répondes que tu souhaites me rencontrer.;Si tu es pressé comme moi, retrouves moi sur le tchat au plus vite.;;;;;;;;;;;;;;;;;;;;;;;;;;;;;;;;;;;;;;;;;;;;;;;;;;;;;;;;;;;;;;;;;;;;;;;;;;;;;;;;;;;;;;;;;;;;;;;;;;;;;;;;;;;;;;;;;;;;;;;;;;;;;;;;;;;;;;;;;;;;;;;;;;;;;;;;;;;;;;;;;;;;;;;;;;;;;;;;;;;;;;;;;;;;;;;;;;;;;;;;;;;;;;;;;;;;;;;;;;;;;;;;;;;;;;;;;;;;;;;;;;;;;;;;;;;
Je n’arrive pas à croire que je te contacte comme ça alors que je ne te connais même pas, mais je sais pas, ton profil m’a mise en confiance, et je ne pense pas que ce soit un hasard.;Je suis là pour faire connaissance avec des mecs, pour prendre du bon temps sans se poser de questions, je ne suis pas ici pour chercher l’amour non plus, ma situation me convient parfaitement.;Je pense que les sites de rencontre c’est sympa pour faire le début du taff mais je préfère de loin boire un verre pour voir si il faut prolonger la rencontre ou pas.;Qu’ajouter de plus à part que si tu refuses de me répondre c’est que vraiment je ne comprends rien aux hommes.;Voila à toi de jouer maintenant.;;;;;;;;;;;;;;;;;;;;;;;;;;;;;;;;;;;;;;;;;;;;;;;;;;;;;;;;;;;;;;;;;;;;;;;;;;;;;;;;;;;;;;;;;;;;;;;;;;;;;;;;;;;;;;;;;;;;;;;;;;;;;;;;;;;;;;;;;;;;;;;;;;;;;;;;;;;;;;;;;;;;;;;;;;;;;;;;;;;;;;;;;;;;;;;;;;;;;;;;;;;;;;;;;;;;;;;;;;;;;;;;;;;;;;;;;;;;;;;;;;;;;;;;;;;
Alors c’est comme ça, tu habites dans la même ville que moi et je n’ai pas eu la chance de te rencontrer… Je pense que je m’en serais souvenue.. Ca te tente que l’on fasse connaissance?;En ce qui me concerne, je suis très jolie et pense pouvoir te plaire et te donner envie d’en savoir plus sur moi. Tu verras, j’aime juste profiter la vie et ne pas gâcher celle des autres.;Bon que dire de plus à part que si de ton côté une femme comme moi te branche, je pense que pour une première rencontre c’est moi qui te mènerai sur mon terrain, je connais un resto très convivial, et qui en plus se trouve juste en bas de chez moi, car ne sait on jamais, on a parfois des envies pressantes lol.;Je dois te dire qu’à l’instant où je t’écris je suis déjà impatiente que tu me répondes.;"Je préfère ne pas te dire à bientôt, mais à tout de suite ;) .";;;;;;;;;;;;;;;;;;;;;;;;;;;;;;;;;;;;;;;;;;;;;;;;;;;;;;;;;;;;;;;;;;;;;;;;;;;;;;;;;;;;;;;;;;;;;;;;;;;;;;;;;;;;;;;;;;;;;;;;;;;;;;;;;;;;;;;;;;;;;;;;;;;;;;;;;;;;;;;;;;;;;;;;;;;;;;;;;;;;;;;;;;;;;;;;;;;;;;;;;;;;;;;;;;;;;;;;;;;;;;;;;;;;;;;;;;;;;;;;;;;;;;;;;;;
Je suis stressée comme une gamine de t’écrire, je dois avouer que tu m’as tapé dans l’oeil. Je suis sur ce site pour rencontrer des mecs qui me plaisent comme toi.;Je ne sais pas si tu es plutôt brune ou blonde, mais saches que j’ai les atouts pour te plaire ça j’en suis certaine.;Bon voila j’ai plus ou moins fait le tour de ce que j’avais à te dire, la balle est dans ton camp maintenant, A toi de voir si je vaux la peine que tu te déplaces pour me rencontrer.;Allez réponds moi vite parceque je trufferais vraiment cruel que celui sur qui j’ai flaché ne prenne même pas la peine de me répondre.;Je vais me connecter un peu plus qu’à l’accoutumée, histoire de ne pas rater ta réponse. A très bientôt.;;;;;;;;;;;;;;;;;;;;;;;;;;;;;;;;;;;;;;;;;;;;;;;;;;;;;;;;;;;;;;;;;;;;;;;;;;;;;;;;;;;;;;;;;;;;;;;;;;;;;;;;;;;;;;;;;;;;;;;;;;;;;;;;;;;;;;;;;;;;;;;;;;;;;;;;;;;;;;;;;;;;;;;;;;;;;;;;;;;;;;;;;;;;;;;;;;;;;;;;;;;;;;;;;;;;;;;;;;;;;;;;;;;;;;;;;;;;;;;;;;;;;;;;;;;
Bonjour, comment ça va? Au risque de passer pour une affamée, je me lâche. Tu es troooop charmant, et je ne décroche plus de ton profil!;Parlons un peu de moi, je suis assez mince et élégante, j’aime prendre soin de moi et encore plus de ceux qui me plaisent, mais ce ne sont que des paroles, je préfère que tu découvres mes qualités par toi même.;Comment je verrais un premier rendez vous avec toi? et bien très classique, on boit un café dans le bar en bas de ma rue, et si tu assures, on ira en boire un autre chez moi, on sera plus au calme.;Je pense que si tu ne réponds pas à mon invitation je n’ai plus rien à faire ici lol, non je plaisante mais moi je veux juste ce qui se fait de mieux ici!!;Bizarrement, aujourd’hui je crois que je ne vais pas fermer ma session dans l’espoir de ton retour.;;;;;;;;;;;;;;;;;;;;;;;;;;;;;;;;;;;;;;;;;;;;;;;;;;;;;;;;;;;;;;;;;;;;;;;;;;;;;;;;;;;;;;;;;;;;;;;;;;;;;;;;;;;;;;;;;;;;;;;;;;;;;;;;;;;;;;;;;;;;;;;;;;;;;;;;;;;;;;;;;;;;;;;;;;;;;;;;;;;;;;;;;;;;;;;;;;;;;;;;;;;;;;;;;;;;;;;;;;;;;;;;;;;;;;;;;;;;;;;;;;;;;;;;;;;
Bonjour, tu dois te demander qui je suis.. C’est vrai qu’on ne se connait pas mais j’ai de mon coté, très envie que l’on fasse connaissance.;Comme tu t’en doutes, je te trouve très charmant, et j’espère que ma jolie silhouette te fera tourner la tête autant que la mienne a tourné en voyant ton profil.;Bon par contre, si tu me donnes une réponse positive, je trouverais dommage de pas se voir au plus vite vu que l’on se trouve l’un l’autre dans le même secteur… Un salon de thé, un resto ou chez moi… On verra bien au moment voulu.;Désolé de passer pour une femme impatiente mais je me dis qu’au plus le temps passe, au plus les autres femmes sont susceptibles de t’éloigner un peu plus de moi.;Je verrai bien assez vite si tu donnes suite ou pas à ma proposition, je serai  sur le tchat ou pas très loin si tu me cherches.;;;;;;;;;;;;;;;;;;;;;;;;;;;;;;;;;;;;;;;;;;;;;;;;;;;;;;;;;;;;;;;;;;;;;;;;;;;;;;;;;;;;;;;;;;;;;;;;;;;;;;;;;;;;;;;;;;;;;;;;;;;;;;;;;;;;;;;;;;;;;;;;;;;;;;;;;;;;;;;;;;;;;;;;;;;;;;;;;;;;;;;;;;;;;;;;;;;;;;;;;;;;;;;;;;;;;;;;;;;;;;;;;;;;;;;;;;;;;;;;;;;;;;;;;;;
Coucou.. Même si c’est pas du tout mon genre, je me lance, je suis tombée sur ta fiche de profil, et tu m’as interpellé, c’est pour ça que j’aimerais que l’on fasse connaissance toi et moi.;Je ne suis pas aussi directe d’habitude, mais je suis vraiment une femme en manque d’affection, et c’est bizarre, mais c’est avec toi que j’ai envie de briser cette solitude et ce manque.;Je n’ai pas énormément de temps libres actuellement mais j’arrive toujours à m’arranger pour un mec craquant comme toi, donc si j’ai un retour de ta part, je suis ouverte pour te rencontrer, j’ai un pied à terre juste derrière la mairie.;J’espère sincèrement que tu te laisseras tenter par une rencontre en tête à tête avec moi car je suis convaincue que tout ça en vaut la peine.;Voilou, si tu me cherches, tu sais maintenant où me trouver.;;;;;;;;;;;;;;;;;;;;;;;;;;;;;;;;;;;;;;;;;;;;;;;;;;;;;;;;;;;;;;;;;;;;;;;;;;;;;;;;;;;;;;;;;;;;;;;;;;;;;;;;;;;;;;;;;;;;;;;;;;;;;;;;;;;;;;;;;;;;;;;;;;;;;;;;;;;;;;;;;;;;;;;;;;;;;;;;;;;;;;;;;;;;;;;;;;;;;;;;;;;;;;;;;;;;;;;;;;;;;;;;;;;;;;;;;;;;;;;;;;;;;;;;;;;
Salut. Je tiens à te dire que c’est la seule fois depuis que je suis sur ce site de rencontre que je prends l’initiative de contacter un mec, mais j’ai lu ton profil, et depuis j’ai vraiment envie de venir te parler.;De mon côté je suis très sportive, et plutôt bien foutue, je suis très soignée et très douce, et j’aime la douceur et les bons moments de la vie. ;Bon je préfère prendre un peu de temps pour te découvrir avant d’aller éventuellement plus loin, mais si tu es partant et si tu sais me mettre en confiance, je peux vite devenir ton passe temps préféré hihihi!!!;Maintenant, il ne me reste plus qu’à croiser les doigts pour espérer que tu liras mon mail, je ne vais pas arrêter de compter les minutes maintenant.;C’est toi le maitre des cartes maintenant, alors à toi de jouer.;;;;;;;;;;;;;;;;;;;;;;;;;;;;;;;;;;;;;;;;;;;;;;;;;;;;;;;;;;;;;;;;;;;;;;;;;;;;;;;;;;;;;;;;;;;;;;;;;;;;;;;;;;;;;;;;;;;;;;;;;;;;;;;;;;;;;;;;;;;;;;;;;;;;;;;;;;;;;;;;;;;;;;;;;;;;;;;;;;;;;;;;;;;;;;;;;;;;;;;;;;;;;;;;;;;;;;;;;;;;;;;;;;;;;;;;;;;;;;;;;;;;;;;;;;;
Coucou toi, j’ai mis du temps avant de me décider mais j’ai fini par me convaincre de me lancer, car j’aimerais échanger un peu avec toi en vue d’une éventuelle future rencontre entre toi et moi.;Je suis une fille très pulpeuse, je tiens ça de mes origines, j’ai des hanches généreuses et j’ai su les apprivoiser pour en faire mon atout majeur hihihi.;Ca me rend dingue car je suis persuadée que l’on habite pas loin l’un de l’autre, et ca me blase de passer ma soirée seule quand je sais qu’un charmant célibataire comme toi se ballade dans mon secteur.;Je vais te dire, tu n’as pas le droit de ne pas me répondre!! Même si tu n’es pas intéressé j’aimerais au moins que tu me donnes tes impressions sur mon petit numéro de charme!!;Je n’ai rien de prévu ce soir, je pense passer sur le tchat, si ça te dit de m’y retrouver…;;;;;;;;;;;;;;;;;;;;;;;;;;;;;;;;;;;;;;;;;;;;;;;;;;;;;;;;;;;;;;;;;;;;;;;;;;;;;;;;;;;;;;;;;;;;;;;;;;;;;;;;;;;;;;;;;;;;;;;;;;;;;;;;;;;;;;;;;;;;;;;;;;;;;;;;;;;;;;;;;;;;;;;;;;;;;;;;;;;;;;;;;;;;;;;;;;;;;;;;;;;;;;;;;;;;;;;;;;;;;;;;;;;;;;;;;;;;;;;;;;;;;;;;;;;
Bonjour, on ne se connait pas encore malheureusement mais plus je m’arrete sur ton profil, plus cela me donne envie de te rencontrer.;Je ne sais pas si tu as un genre de femme qui t’attire en particulier, mais saches que je pense de mon coté avoir le charme nécessaire pour te donner envie de me découvrir un peu plus.;Alors j’attends ta réponse joli célibataire… Et puis un petit café n’engage en  rien et au moins cela permet de ne pas avoir de regrets.;Bon il me reste plus qu’à espérer que tu prennes la peine de me répondre , parce que j’y tiens vraiment.;Ne fais pas ton timide avec moi, oui ou non ne changera pas la bonne opinion que je me suis faite sur toi.;;;;;;;;;;;;;;;;;;;;;;;;;;;;;;;;;;;;;;;;;;;;;;;;;;;;;;;;;;;;;;;;;;;;;;;;;;;;;;;;;;;;;;;;;;;;;;;;;;;;;;;;;;;;;;;;;;;;;;;;;;;;;;;;;;;;;;;;;;;;;;;;;;;;;;;;;;;;;;;;;;;;;;;;;;;;;;;;;;;;;;;;;;;;;;;;;;;;;;;;;;;;;;;;;;;;;;;;;;;;;;;;;;;;;;;;;;;;;;;;;;;;;;;;;;;
Bonjour, on n’a pas la chance de se connaitre, mais depuis un moment, je souhaite faire ta connaissance. J’ai hésité longtemps, mais je me suis dite que c’était dommage de ne pas le faire et que de toute façon, je n’avais rien à faire.;Tu sais ce que tu m’inspires? Tu m’inspires la douceur qui me manque en ce moment, tu m’inspires la sécurité qui permet de me laisser aller. J’ai envie de voir si je dis vrai, je ne pense pas me tromper.;J’espère vraiment avoir un retour de ta part même si c’est négatif, saches que j’attends quelque jours avant de relancer d’autres pistes, mais tu es aujourd’hui ma priorité ici…;"Bon monsieur le playboy, je te préviens que si tu ne me réponds pas ou que pire tu refuses mon invitation, ne fais pas de l’autostop parce que je te laisserais marcher moi !!!! ;)";En général je me connecte en début de soirée, alors n’hésites pas à venir me parler.;;;;;;;;;;;;;;;;;;;;;;;;;;;;;;;;;;;;;;;;;;;;;;;;;;;;;;;;;;;;;;;;;;;;;;;;;;;;;;;;;;;;;;;;;;;;;;;;;;;;;;;;;;;;;;;;;;;;;;;;;;;;;;;;;;;;;;;;;;;;;;;;;;;;;;;;;;;;;;;;;;;;;;;;;;;;;;;;;;;;;;;;;;;;;;;;;;;;;;;;;;;;;;;;;;;;;;;;;;;;;;;;;;;;;;;;;;;;;;;;;;;;;;;;;;;
